{
  "$schema": "structures-schema.json",
  "description": "High-level data and infrastructure structure families used by /engage-exocortex. Algorithmic families anchor recognition for subagents; the two umbrella families (infrastructure-component, data-and-telemetry-layer) collect runtime and persistence patterns. Slim catalog per #215 AC8 — pre-slim catalog archived under retired/2026-05-16/.",
  "usage": "Subagents identify a primary family in their brief; sub-variants supply more specific labels. The catalog is a palette, not an exhaustive routing substrate.",
  "families": [
    {
      "id": "heap-priority-queue",
      "name": "Heap / Priority Queue",
      "coreContract": "Insert in O(log n); extract the minimum (or maximum) in O(log n); peek in O(1). Does not support arbitrary access or update without augmentation.",
      "whenToPrefer": [
        "You repeatedly need the globally best element (min or max) from a changing set",
        "Dijkstra-style 'process cheapest frontier node next'",
        "K-way merging, top-K queries, sliding window maximum without monotonic queue"
      ],
      "variants": [
        {
          "name": "Binary min/max heap",
          "characteristic": "Standard; O(log n) push/pop",
          "bestUsedWhen": "General priority queue needs"
        },
        {
          "name": "Indexed heap (heap + position map)",
          "characteristic": "O(log n) decrease-key by tracking positions",
          "bestUsedWhen": "Dijkstra with edge relaxation, Prim's MST"
        },
        {
          "name": "Two-heap partition",
          "characteristic": "One min-heap + one max-heap sharing a population",
          "bestUsedWhen": "Median of a data stream, range median"
        },
        {
          "name": "Monotonic deque (deque-as-heap)",
          "characteristic": "Maintains sorted order by evicting dominated elements",
          "bestUsedWhen": "Sliding window max/min in O(n) total"
        },
        {
          "name": "Lazy deletion heap",
          "characteristic": "Stale entries left in heap; validity checked at pop time",
          "bestUsedWhen": "Interval scheduling, task cooldown, sweep line events"
        },
        {
          "name": "K-way merge heap",
          "characteristic": "One entry per input stream; pop + re-insert from same stream",
          "bestUsedWhen": "Merge K sorted lists, external sort"
        }
      ],
      "implementationTraps": [
        "Python's heapq is min-heap only — negate values for max-heap; don't forget to negate back",
        "Lazy deletion requires a 'seen' set or a version counter; forgetting this causes incorrect pops",
        "Two-heap median: rebalancing invariant (size difference <= 1) must be maintained on every insert and remove",
        "Indexed heap position map must be updated on every swap during sift-up/sift-down, not just at insert"
      ],
      "disqualifiers": [
        "Need to find an arbitrary element (use hash map instead)",
        "Need sorted iteration over the full set (use BST or sort)",
        "The set is static — just sort once"
      ]
    },
    {
      "id": "tree-variants",
      "name": "Tree Variants",
      "coreContract": "A family of hierarchical structures offering O(log n) search, insert, and delete on ordered data, plus range queries. The specific variant determines what additional operations are O(log n) vs O(n).",
      "whenToPrefer": [
        "Data is ordered and you need both point queries and range queries",
        "Dynamic set with frequent insertions/deletions (vs. static -> just sort)",
        "Need rank queries ('how many elements <= X?') or order statistics"
      ],
      "variants": [
        {
          "name": "BST (unbalanced)",
          "characteristic": "Simple; degrades to O(n) on sorted input",
          "bestUsedWhen": "Never in production; useful for teaching"
        },
        {
          "name": "AVL / Red-Black tree",
          "characteristic": "Self-balancing; O(log n) guaranteed",
          "bestUsedWhen": "Ordered map/set (most language std libs)"
        },
        {
          "name": "Segment tree",
          "characteristic": "Each node covers a range; supports range query + point update",
          "bestUsedWhen": "Range sum/min/max with point updates"
        },
        {
          "name": "Segment tree with lazy propagation",
          "characteristic": "Deferred range updates; O(log n) range update + range query",
          "bestUsedWhen": "Range add + range sum, range set + range min"
        },
        {
          "name": "Fenwick tree (BIT)",
          "characteristic": "Implicit tree via index bit tricks; smaller constant than segment tree",
          "bestUsedWhen": "Prefix sum with point update; 2D variants for grid"
        },
        {
          "name": "Trie (prefix tree)",
          "characteristic": "Characters at edges; O(L) ops where L = string length",
          "bestUsedWhen": "Prefix matching, autocomplete, XOR maximization"
        },
        {
          "name": "Persistent segment tree",
          "characteristic": "Each update creates a new root; old versions accessible",
          "bestUsedWhen": "Range kth element, versioned data, offline queries"
        },
        {
          "name": "Merge sort tree",
          "characteristic": "Segment tree where each node stores a sorted array of its range",
          "bestUsedWhen": "Count elements in range [L,R] satisfying a predicate"
        },
        {
          "name": "K-d tree",
          "characteristic": "Partitions k-dimensional space alternating on each axis",
          "bestUsedWhen": "Nearest neighbor in 2D/3D, range search in space"
        },
        {
          "name": "Cartesian tree / Treap",
          "characteristic": "Heap-ordered by priority, BST-ordered by key; randomized balance",
          "bestUsedWhen": "Implicit sequence with split/merge, rope data structure"
        }
      ],
      "implementationTraps": [
        "Segment tree: 1-indexed vs 0-indexed; size must be next power of 2 or use recursive build",
        "Lazy propagation: the lazy tag must be pushed down before recursing into children, not after",
        "Fenwick tree: update(i, delta) and query(i) are both 1-indexed; off-by-one errors are common",
        "Trie: remember to handle end-of-word markers separately from the existence of a child node",
        "Persistent structures: copying the path (O(log n) nodes) not the whole tree"
      ],
      "disqualifiers": [
        "Updates are rare and queries are batch -> sort offline instead",
        "Data is unordered and you only need exact-match lookup -> hash map is faster and simpler",
        "N is small (< 1000) -> just use a sorted array with binary search"
      ]
    },
    {
      "id": "hash-based-structures",
      "name": "Hash-Based Structures",
      "coreContract": "O(1) average insert, delete, and lookup. No ordering. Worst-case O(n) due to collisions, but rare with good hash functions.",
      "whenToPrefer": [
        "Fast exact-match lookup is the bottleneck",
        "Counting frequencies, detecting duplicates, memoizing seen states",
        "The key space is large but the active set is sparse"
      ],
      "variants": [
        {
          "name": "HashMap / dictionary",
          "characteristic": "Key -> value; O(1) average",
          "bestUsedWhen": "Any frequency count, index lookup, memo table"
        },
        {
          "name": "HashSet",
          "characteristic": "Membership only; O(1) average",
          "bestUsedWhen": "Visited set in BFS, duplicate detection"
        },
        {
          "name": "Counting array",
          "characteristic": "Fixed-range keys (e.g., chars, small ints); O(1) true worst-case",
          "bestUsedWhen": "Character frequency, bucket sort"
        },
        {
          "name": "Rolling hash",
          "characteristic": "Hash of a sliding window updated incrementally",
          "bestUsedWhen": "Rabin-Karp substring search, longest duplicate substring"
        },
        {
          "name": "Polynomial hash / string hashing",
          "characteristic": "Map strings to integers for O(1) comparison",
          "bestUsedWhen": "Anagram grouping, palindrome detection over substrings"
        },
        {
          "name": "Two-sum complement map",
          "characteristic": "Store seen values; for each new value check if complement exists",
          "bestUsedWhen": "Two-sum, subarray sum equals K (prefix sum + map)"
        },
        {
          "name": "Coordinate compression + map",
          "characteristic": "Map large sparse values to dense indices",
          "bestUsedWhen": "Segment tree on large value range, offline range queries"
        }
      ],
      "implementationTraps": [
        "Rolling hash collisions: use double hashing (two independent moduli) to reduce false positives",
        "Python dicts preserve insertion order (3.7+) — don't rely on this in language-agnostic solutions",
        "Counting array bounds: ensure the array is sized for the full input range, not just what you've seen",
        "Coordinate compression: compress after reading all input; queries must use the same mapping as updates"
      ],
      "disqualifiers": [
        "Need to iterate in sorted order (use BST or sorted array)",
        "Need range queries ('all keys between X and Y') -> hash maps can't do this",
        "Adversarial inputs can cause hash collisions -> use randomized hash or tree map"
      ]
    },
    {
      "id": "graph-representations",
      "name": "Graph Representations",
      "coreContract": "Encodes vertices and edges; the representation chosen governs the cost of the operations most frequently used (adjacency test, neighbor enumeration, edge weight lookup).",
      "whenToPrefer": [],
      "variants": [
        {
          "name": "Adjacency list",
          "characteristic": "Space O(V + E); adjacency test O(degree); neighbor list O(degree)",